{
  "schemaVersion": 1,
  "repository": "pawnkit/pawnlint",
  "maturity": "preview",
  "platforms": ["linux-amd64", "windows-amd64", "darwin-arm64"],
  "profiles": ["samp-037", "openmp"],
  "compilers": [
    { "name": "pawncc", "version": "3.10.10" },
    { "name": "openmp-pawncc", "version": "3.10.11" }
  ],
  "contracts": [
    { "name": "pawn-diagnostic", "major": 2 },
    { "name": "pawn-project", "major": 1 }
  ],
  "limitations": [
    "Real-project checks cover pinned projects rather than every community include."
  ]
}
